{
  "handle_length": "short",
  "body_length": "short",
  "grip_topology": "one_hand_handle",
  "rigidity": "rigid",
  "mass_distribution": "front",
  "contact_surface": "broad",
  "secondary_contact_surface": "none",
  "has_point": false,
  "has_edge": false,
  "has_broad_face": true,
  "has_barrel": false,
  "has_stock": false,
  "confidence": 1.0,
  "evidence_parts": [
    "short handle",
    "broad pan body",
    "front-weighted contact face"
  ],
  "real_length_cm": 40.0
}
